{
  "schemaVersion": 1,
  "version": "2.9.0",
  "phase": "UI-FOUNDATION-PHASE5-V273",
  "status": "dialog-modal-drawer-hardening-v273+table-system-v286+compact-filter-controls-v295",
  "styleSystem": {
    "manifest": "styles/manifest/style-manifest.json",
    "runtimeEntry": "app/bootstrap/styles.ts",
    "generator": "scripts/generate-style-bootstrap.mjs",
    "directCssImportsAllowedIn": [
      "app/bootstrap/styles.ts",
      "miniapp/index.tsx"
    ],
    "pageLevelCssImportsAllowed": false,
    "newLocalCssFilesAllowed": false,
    "patchStyleFilesMayOnlyDecrease": true,
    "importantUsageMayOnlyDecrease": true
  },
  "responsiveContract": {
    "status": "enforced",
    "breakpoints": {
      "mobile": 640,
      "tablet": 768,
      "desktop": 1024,
      "wide": 1280
    },
    "newArbitraryBreakpointsAllowed": false
  },
  "layerContract": {
    "status": "enforced",
    "layers": {
      "base": 0,
      "sticky": 40,
      "header": 900,
      "sheetBackdrop": 9000,
      "sheet": 9010,
      "drawerBackdrop": 9100,
      "drawer": 9110,
      "modalBackdrop": 9200,
      "modal": 9210,
      "commandBackdrop": 9400,
      "command": 9410,
      "dropdown": 9600,
      "popover": 9700,
      "tooltip": 9800,
      "floating": 9900,
      "toast": 11000
    },
    "newArbitraryZIndexAllowed": false,
    "hostOwnership": "components/ui/overlayContract.ts",
    "portalOwnership": "components/ui/PortalLayer.tsx",
    "anchoredPositionOwnership": "components/ui/useAnchoredOverlayPosition.ts",
    "thirdPartyPortalsMustUseSemanticHost": true
  },
  "componentPolicy": {
    "canonicalImportPath": "@/components/ui",
    "newRawPrimitivesAllowed": false,
    "newDuplicateComponentsAllowed": false,
    "legacyUsageMayOnlyDecrease": true,
    "directCanonicalFileImportsAllowed": false,
    "newLegacyImportsAllowed": false
  },
  "components": [
    {
      "id": "button",
      "role": "action",
      "canonicalPath": "components/Button.tsx",
      "barrelPath": "components/ui/index.ts",
      "exportName": "Button",
      "status": "canonical",
      "owner": "ui-foundation",
      "replaces": [
        "button"
      ]
    },
    {
      "id": "action-control-contract",
      "role": "action-contract",
      "canonicalPath": "components/ui/actionControlContract.tsx",
      "barrelPath": "components/ui/index.ts",
      "exportName": "actionControlVariantClassMap",
      "status": "canonical",
      "owner": "ui-foundation",
      "replaces": [
        "page-level-action-variant-map"
      ]
    },
    {
      "id": "action-link",
      "role": "action-navigation",
      "canonicalPath": "components/ui/ActionLink.tsx",
      "barrelPath": "components/ui/index.ts",
      "exportName": "ActionLink",
      "status": "canonical",
      "owner": "ui-foundation",
      "replaces": [
        "operational-link-button"
      ]
    },
    {
      "id": "dialog-shell",
      "role": "overlay-foundation",
      "canonicalPath": "components/ui/DialogShell.tsx",
      "barrelPath": "components/ui/index.ts",
      "exportName": "DialogShell",
      "status": "canonical",
      "owner": "ui-foundation",
      "replaces": []
    },
    {
      "id": "drawer",
      "role": "overlay-drawer",
      "canonicalPath": "components/ui/Drawer.tsx",
      "barrelPath": "components/ui/index.ts",
      "exportName": "Drawer",
      "status": "canonical",
      "owner": "ui-foundation",
      "replaces": [
        "raw-fixed-side-drawer",
        "page-owned-report-drawer-shell"
      ]
    },
    {
      "id": "dialog",
      "role": "overlay",
      "canonicalPath": "components/ui/Dialog.tsx",
      "barrelPath": "components/ui/index.ts",
      "exportName": "Dialog",
      "status": "canonical",
      "owner": "ui-foundation",
      "replaces": [
        "components/Modal.tsx",
        "components/modals/AppModal.tsx"
      ]
    },
    {
      "id": "dialog-actions",
      "role": "overlay-actions",
      "canonicalPath": "components/ui/DialogActions.tsx",
      "barrelPath": "components/ui/index.ts",
      "exportName": "DialogActions",
      "status": "canonical",
      "owner": "ui-foundation",
      "replaces": [
        "components/ModalActions.tsx",
        "components/modals/ModalActions.tsx"
      ]
    },
    {
      "id": "modal-field",
      "role": "overlay-form-field",
      "canonicalPath": "components/ui/ModalField.tsx",
      "barrelPath": "components/ui/index.ts",
      "exportName": "ModalField",
      "status": "canonical",
      "owner": "ui-foundation",
      "replaces": [
        "components/ModalField.tsx"
      ]
    },
    {
      "id": "portal-layer",
      "role": "overlay-layer",
      "canonicalPath": "components/ui/PortalLayer.tsx",
      "barrelPath": "components/ui/index.ts",
      "exportName": "PortalLayer",
      "status": "canonical",
      "owner": "ui-foundation",
      "replaces": [
        "page-local createPortal usage",
        "page-local popover portal wrapper"
      ]
    },
    {
      "id": "tooltip-layer",
      "role": "feedback-overlay",
      "canonicalPath": "components/SmartTooltipLayer.tsx",
      "barrelPath": "components/ui/index.ts",
      "exportName": "SmartTooltipLayer",
      "status": "canonical",
      "owner": "ui-foundation",
      "replaces": [
        "native-title-tooltip",
        "smart-tooltip-layer"
      ]
    },
    {
      "id": "page-shell",
      "role": "page-layout",
      "canonicalPath": "components/ui/PageShell.tsx",
      "barrelPath": "components/ui/index.ts",
      "exportName": "PageShell",
      "status": "canonical",
      "owner": "ui-foundation",
      "replaces": []
    },
    {
      "id": "management-directory",
      "role": "management-directory-layout",
      "canonicalPath": "components/ui/ManagementDirectory.tsx",
      "barrelPath": "components/ui/index.ts",
      "exportName": "ManagementDirectoryHero",
      "status": "canonical",
      "owner": "ui-foundation",
      "replaces": [
        "page-local-management-hero",
        "page-local-kpi-grid",
        "page-local-directory-filter-surface",
        "page-local-directory-list-surface"
      ]
    },
    {
      "id": "panel-card",
      "role": "surface",
      "canonicalPath": "components/ui/PanelCard.tsx",
      "barrelPath": "components/ui/index.ts",
      "exportName": "PanelCard",
      "status": "canonical",
      "owner": "ui-foundation",
      "replaces": [
        "card"
      ]
    },
    {
      "id": "data-table-shell",
      "role": "data-table",
      "canonicalPath": "components/ui/DataTableShell.tsx",
      "barrelPath": "components/ui/index.ts",
      "exportName": "DataTableShell",
      "status": "canonical",
      "owner": "ui-foundation",
      "replaces": [
        "table"
      ]
    },
    {
      "id": "table-system",
      "role": "data-table-foundation",
      "canonicalPath": "components/ui/TableSystem.tsx",
      "barrelPath": "components/ui/index.ts",
      "exportName": "Table",
      "status": "canonical",
      "owner": "ui-foundation",
      "replaces": [
        "raw-runtime-table",
        "page-local-table-overflow-wrapper"
      ]
    },
    {
      "id": "table-pagination",
      "role": "data-table-pagination",
      "canonicalPath": "components/ui/TablePagination.tsx",
      "barrelPath": "components/ui/index.ts",
      "exportName": "TablePagination",
      "status": "canonical",
      "owner": "ui-foundation",
      "replaces": [
        "page-local-table-pagination"
      ]
    },
    {
      "id": "table-action-group",
      "role": "data-table-actions",
      "canonicalPath": "components/ui/TableActionGroup.tsx",
      "barrelPath": "components/ui/index.ts",
      "exportName": "TableActionGroup",
      "status": "canonical",
      "owner": "ui-foundation",
      "replaces": [
        "table-row-action-cluster",
        "mobile-row-action-menu"
      ]
    },
    {
      "id": "search-field",
      "role": "search",
      "canonicalPath": "components/ui/AppSearchField.tsx",
      "barrelPath": "components/ui/index.ts",
      "exportName": "AppSearchField",
      "status": "canonical",
      "owner": "ui-foundation",
      "replaces": [
        "search"
      ]
    },
    {
      "id": "form-control-contract",
      "role": "form-control-contract",
      "canonicalPath": "components/ui/formControlContract.ts",
      "barrelPath": "components/ui/index.ts",
      "exportName": "DEFAULT_FORM_CONTROL_SIZE",
      "status": "canonical",
      "owner": "ui-foundation",
      "replaces": []
    },
    {
      "id": "text-field",
      "role": "form-control",
      "canonicalPath": "components/ui/TextField.tsx",
      "barrelPath": "components/ui/index.ts",
      "exportName": "TextField",
      "status": "canonical",
      "owner": "ui-foundation",
      "replaces": [
        "input"
      ]
    },
    {
      "id": "select-field",
      "role": "form-control",
      "canonicalPath": "components/ui/SelectField.tsx",
      "barrelPath": "components/ui/index.ts",
      "exportName": "SelectField",
      "status": "canonical",
      "owner": "ui-foundation",
      "replaces": [
        "select"
      ]
    },
    {
      "id": "checkbox-field",
      "role": "form-control",
      "canonicalPath": "components/ui/CheckboxField.tsx",
      "barrelPath": "components/ui/index.ts",
      "exportName": "CheckboxField",
      "status": "canonical",
      "owner": "ui-foundation",
      "replaces": [
        "input[type=checkbox]"
      ]
    },
    {
      "id": "range-field",
      "role": "form-control",
      "canonicalPath": "components/ui/RangeField.tsx",
      "barrelPath": "components/ui/index.ts",
      "exportName": "RangeField",
      "status": "canonical",
      "owner": "ui-foundation",
      "replaces": [
        "input[type=range]"
      ]
    },
    {
      "id": "textarea-field",
      "role": "form-control",
      "canonicalPath": "components/ui/TextareaField.tsx",
      "barrelPath": "components/ui/index.ts",